{
  "version": "r1if-review-input-v1",
  "frozen_sha": "9c804a566a166fd96cb7b385a0ca9dfc43bcbb9b",
  "candidates": [
    {
      "id": "outgoing-bounded-placement-index",
      "family": "outgoing bound",
      "mechanism": "replace each outgoing-bound placementByInstanceID string map and its placed-target string lookups with a bounded OriginalIndex placement index, retaining exact fallback for malformed or duplicate index/ID domains",
      "parent_metric": {"kind": "function", "symbol": "backpack-brawl-solver/internal/solver.(*outgoingBoundContext).upperPriorityCounts", "value": "cum"},
      "target_metric": {"kind": "source_lines", "extract_id": "outgoing-upper-priority", "routine": "backpack-brawl-solver/internal/solver.(*outgoingBoundContext).upperPriorityCounts", "lines": [59, 82], "value": "cum"},
      "per_case_target_metric": {"kind": "source_lines", "extract_id": "outgoing-upper-priority", "routine": "backpack-brawl-solver/internal/solver.(*outgoingBoundContext).upperPriorityCounts", "lines": [59, 82], "value": "cum"},
      "v4_target_metric": {"kind": "source_lines", "extract_id": "outgoing-upper-priority", "routine": "backpack-brawl-solver/internal/solver.(*outgoingBoundContext).upperPriorityCounts", "lines": [59, 82], "value": "cum"},
      "alloc_space_metric": {"sample_index": "alloc_space", "symbol": "backpack-brawl-solver/internal/solver.placementByInstanceID", "value": "flat"},
      "alloc_objects_metric": {"sample_index": "alloc_objects", "symbol": "backpack-brawl-solver/internal/solver.placementByInstanceID", "value": "flat"},
      "plausible_removal_fraction": 0.75,
      "operation_metrics": [
        {"family": "outgoing", "field": "placed_map_builds"},
        {"family": "outgoing", "field": "placed_map_insertions"},
        {"family": "outgoing", "field": "target_placement_lookups"},
        {"family": "outgoing", "field": "placed_targets_found"}
      ],
      "operation_breadth_note": "bound-attribution-ops-v1 serializes map builds, insertions, target lookups, and successful finds; the analyzer derives 1M breadth and volume over all fourteen development cases",
      "complexity_class": "C1",
      "semantic_risk": "medium but bounded: OriginalIndex density, duplicate and empty InstanceID behavior, duplicate indices, last-write map semantics, and malformed placements require an exact string-map fallback and differential oracle",
      "evidence_quality": "high: two non-overlapping source lines are mechanically summed; 6/6 material CPU breadth, 14/14 deterministic operation breadth, V4 reproduction, and direct heap attribution",
      "extract_citations": [
        "derived/cpu-source-outgoing-upper-priority.txt",
        "derived/cpu-callers.txt",
        "derived/v4/cpu-source-outgoing-upper-priority.txt",
        "derived/per-case/gsv2-013-source-outgoing-upper-priority.txt",
        "derived/per-case/gsv2-015-source-outgoing-upper-priority.txt",
        "derived/per-case/gsv2-016-source-outgoing-upper-priority.txt",
        "derived/per-case/gsv2-018-source-outgoing-upper-priority.txt",
        "derived/per-case/gsv2-021-source-outgoing-upper-priority.txt",
        "derived/per-case/gsv2-024-source-outgoing-upper-priority.txt",
        "derived/heap-alloc-space.txt",
        "derived/heap-alloc-objects.txt"
      ],
      "parent": "outgoingBoundContext.upperPriorityCounts",
      "child": "exclusive sibling edges at outgoing_bound.go:59 map construction and :82 placed-target lookup",
      "exclusive_subregion": true,
      "overlap_group": "outgoing-placement-index",
      "promotion_gate": {
        "causal_region_isolable": true,
        "semantic_risk_acceptable": true,
        "no_stronger_overlapping_explanation": true
      },
      "disposition": "PROMOTE",
      "rationale": "the exact shared bounded index removes two disjoint string-map edges, clears the C1 bar conservatively, is broad in CPU and operations, reproduces in V4, and can preserve malformed-domain behavior through an explicit legacy fallback"
    },
    {
      "id": "incremental-plateau-archive-selection",
      "family": "plateau archive",
      "mechanism": "replace per-observation full selectPlateauEntries regroup-and-multi-sort with an incremental capacity-32 update preserving the exact selected set and order",
      "parent_metric": {"kind": "function", "symbol": "backpack-brawl-solver/internal/solver.(*plateauArchive).observe", "value": "cum"},
      "target_metric": {"kind": "function", "symbol": "backpack-brawl-solver/internal/solver.selectPlateauEntries", "value": "cum"},
      "per_case_target_metric": {"kind": "function", "symbol": "backpack-brawl-solver/internal/solver.selectPlateauEntries", "value": "cum"},
      "v4_target_metric": {"kind": "function", "symbol": "backpack-brawl-solver/internal/solver.selectPlateauEntries", "value": "cum"},
      "alloc_space_metric": {"sample_index": "alloc_space", "symbol": "backpack-brawl-solver/internal/solver.selectPlateauEntries", "value": "cum"},
      "alloc_objects_metric": {"sample_index": "alloc_objects", "symbol": "backpack-brawl-solver/internal/solver.selectPlateauEntries", "value": "cum"},
      "plausible_removal_fraction": 0.75,
      "operation_metrics": [],
      "operation_breadth_note": "unavailable: no serialized archive observation, reselection, admission, or selected-order operation counter exists",
      "complexity_class": "C2",
      "semantic_risk": "high: archive membership, order, signature diversity, admissions/rejections, and downstream repair bases are structural search semantics",
      "evidence_quality": "high causal CPU/heap attribution and V4 reproduction, but objective CPU breadth is concentrated at 2/6 and operation breadth is unavailable",
      "extract_citations": [
        "derived/cpu-source-plateau-observe.txt",
        "derived/cpu-source-plateau-select.txt",
        "derived/v4/cpu-source-plateau-select.txt",
        "derived/per-case/gsv2-018-source-plateau-select.txt",
        "derived/per-case/gsv2-024-source-plateau-select.txt",
        "derived/heap-alloc-space.txt"
      ],
      "parent": "plateauArchive.observe",
      "child": "selectPlateauEntries",
      "exclusive_subregion": true,
      "overlap_group": "plateau-full-reselection",
      "promotion_gate": {
        "causal_region_isolable": true,
        "semantic_risk_acceptable": false,
        "no_stronger_overlapping_explanation": true
      },
      "archive_semantics": {
        "admission_semantics": "admission and rejection counts must remain identical for every observation, including duplicate-layout rejection before selection",
        "selected_set_equivalence": "the exact capacity-32 canonical-layout set must match full regrouping after every observation",
        "selected_order_equivalence": "the exact score/signature/hash ordering returned to bases must match",
        "signature_diversity": "one representative per signature and canonical-layout diversity fallback must retain current tie-breaking",
        "downstream_base_selection": "repair base enumeration consumes archive order and membership, so both must be differential-oracle equivalent"
      },
      "disposition": "REJECT",
      "rationale": "despite the largest aggregate edge, it remains material in only two of six cases and fails the frozen broadness and semantic-risk gates while a broad C1 mechanism clears its bar"
    },
    {
      "id": "outgoing-static-star-compatibility",
      "family": "outgoing bound",
      "mechanism": "reuse an immutable per-stage source-star-target compatibility relation inside sourceHitsTargetWithCatalog instead of reevaluating static catalog predicates",
      "parent_metric": {"kind": "function", "symbol": "backpack-brawl-solver/internal/solver.sourceHitsTargetWithCatalog", "value": "cum"},
      "target_metric": {"kind": "source_lines", "extract_id": "outgoing-source-hit", "routine": "backpack-brawl-solver/internal/solver.sourceHitsTargetWithCatalog", "lines": [540], "value": "cum"},
      "per_case_target_metric": {"kind": "source_lines", "extract_id": "outgoing-source-hit", "routine": "backpack-brawl-solver/internal/solver.sourceHitsTargetWithCatalog", "lines": [540], "value": "cum"},
      "v4_target_metric": {"kind": "source_lines", "extract_id": "outgoing-source-hit", "routine": "backpack-brawl-solver/internal/solver.sourceHitsTargetWithCatalog", "lines": [540], "value": "cum"},
      "plausible_removal_fraction": 0.75,
      "operation_metrics": [
        {"family": "outgoing", "field": "source_hits_target_calls"},
        {"family": "outgoing", "field": "source_hits_target_true"}
      ],
      "operation_breadth_note": "bound-attribution-ops-v1 serializes source-hit calls and outcomes for analyzer-derived fourteen-case breadth",
      "complexity_class": "C1",
      "semantic_risk": "medium: relation construction and all malformed catalog/star fallbacks must be identical",
      "evidence_quality": "high source-line isolation with broad CPU and deterministic operation attribution plus exact V4 reproduction",
      "extract_citations": [
        "derived/cpu-source-outgoing-source-hit.txt",
        "derived/v4/cpu-source-outgoing-source-hit.txt",
        "derived/canonical-profile-data.json"
      ],
      "parent": "sourceHitsTargetWithCatalog",
      "child": "scoring.StarMatchesCatalogItems caller at coverage.go:540",
      "exclusive_subregion": true,
      "overlap_group": "outgoing-source-target-scan",
      "promotion_gate": {
        "causal_region_isolable": true,
        "semantic_risk_acceptable": true,
        "no_stronger_overlapping_explanation": true
      },
      "disposition": "REJECT",
      "rationale": "broad and isolable, but its conservative whole-program benefit remains below the C1 bar"
    },
    {
      "id": "outgoing-coverage-key-reuse",
      "family": "outgoing bound",